id,title,score,num_comments,author,created_utc,url,over_18,edited,spoiler,stickied
1ikun2h,"Whats the ""meta"" tech stack right now? Additionally, what's the ""never going to go away"" stack?",84,98,Maple_Mathlete,2025-02-08 18:56:34,https://www.reddit.com/r/dataengineering/comments/1ikun2h/whats_the_meta_tech_stack_right_now_additionally/,False,False,False,False
1ikmfsr,When or where did you learn the most in your career?,58,23,Spooked_DE,2025-02-08 12:42:40,https://www.reddit.com/r/dataengineering/comments/1ikmfsr/when_or_where_did_you_learn_the_most_in_your/,False,False,False,False
1ikqxnh,How To Become a Data Engineer - Part 1,45,6,imperialka,2025-02-08 16:20:38,https://kevinagbulos.com/how-to-become-a-data-engineer/,False,False,False,False
1ikoo3d,"Anyone transition from a data engineer to a data platform engineer? If so, how is it going for you so far?",38,20,Illustrious-Pound266,2025-02-08 14:39:58,https://www.reddit.com/r/dataengineering/comments/1ikoo3d/anyone_transition_from_a_data_engineer_to_a_data/,False,False,False,False
1il1rv5,Studying DE on my own,30,12,Lanky_Mongoose_2196,2025-02-09 00:12:36,https://www.reddit.com/r/dataengineering/comments/1il1rv5/studying_de_on_my_own/,False,False,False,False
1iktwqp,How valuable would it be to learn something like Kubernetes?,17,16,grep212,2025-02-08 18:25:47,https://www.reddit.com/r/dataengineering/comments/1iktwqp/how_valuable_would_it_be_to_learn_something_like/,False,False,False,False
1iklgck,"You are moving from your existing consultancy to our consultancy, why not just move projects and not move jobs? How would you answer this question?",10,15,RagingCharlotte,2025-02-08 11:39:15,https://www.reddit.com/r/dataengineering/comments/1iklgck/you_are_moving_from_your_existing_consultancy_to/,False,False,False,False
1iknd8i,Release Rucat 0.1.0,8,1,Remzi670,2025-02-08 13:34:18,https://www.reddit.com/r/dataengineering/comments/1iknd8i/release_rucat_010/,False,False,False,False
1il7pcl,Is it possible to change Source of a adf pipeline dynamically?(eg from azure to sap ),9,8,omghag18,2025-02-09 05:32:23,https://www.reddit.com/r/dataengineering/comments/1il7pcl/is_it_possible_to_change_source_of_a_adf_pipeline/,False,False,False,False
1iksl3x,Technologies change suggestion,8,27,Returnforgood,2025-02-08 17:30:25,https://www.reddit.com/r/dataengineering/comments/1iksl3x/technologies_change_suggestion/,False,False,False,False
1ikugx8,How to practise/get better with Data modelling?Seeking recommendations,6,3,theaitribe,2025-02-08 18:49:18,https://www.reddit.com/r/dataengineering/comments/1ikugx8/how_to_practiseget_better_with_data/,False,False,False,False
1ikltvc,"Hi, as a recruiter or HM will you consider a basic data pipeline as a project for a 2yoe good??",5,8,Worried-Diamond-6674,2025-02-08 12:04:30,https://www.reddit.com/r/dataengineering/comments/1ikltvc/hi_as_a_recruiter_or_hm_will_you_consider_a_basic/,False,False,False,False
1iks9et,Mastering cross-database operations with PostgreSQL FDW,5,0,der_gopher,2025-02-08 17:16:52,https://packagemain.tech/p/mastering-cross-database-operations-with-postgres-fdw,False,False,False,False
1ikpsxs,Data engineer to high paying jobs in Canada ?,6,10,InternationalEye360,2025-02-08 15:31:09,https://www.reddit.com/r/dataengineering/comments/1ikpsxs/data_engineer_to_high_paying_jobs_in_canada/,False,False,False,False
1iknb90,Help Me Write Data Architect Questions?,4,11,JSBAWB,2025-02-08 13:31:25,https://www.reddit.com/r/dataengineering/comments/1iknb90/help_me_write_data_architect_questions/,False,False,False,False
1il9maa,Architecture advice needed: Building content similarity & performance analysis system at scale,6,0,jamesftf,2025-02-09 07:40:27,https://www.reddit.com/r/dataengineering/comments/1il9maa/architecture_advice_needed_building_content/,False,False,False,False
1il55kf,Career Growth and Reflections of a Data Development Engineer,3,1,dyzcs,2025-02-09 03:05:33,https://www.reddit.com/r/dataengineering/comments/1il55kf/career_growth_and_reflections_of_a_data/,False,False,False,False
1ikudx6,Exploring AI learning resources and applications,1,2,rishikaidnani,2025-02-08 18:45:36,https://www.reddit.com/r/dataengineering/comments/1ikudx6/exploring_ai_learning_resources_and_applications/,False,False,False,False
1iknrtj,DP-203 exam resources,1,4,Electrical-Leopard55,2025-02-08 13:55:13,https://www.reddit.com/r/dataengineering/comments/1iknrtj/dp203_exam_resources/,False,False,False,False
1il8lfm,Looking for AWS data engineer job support,0,1,Overall_Bad4220,2025-02-09 06:29:20,https://www.reddit.com/r/dataengineering/comments/1il8lfm/looking_for_aws_data_engineer_job_support/,False,False,False,False
1il9t0d,Ai awareness and evolution,0,0,Medium_Animator_7411,2025-02-09 07:54:19,https://www.reddit.com/r/dataengineering/comments/1il9t0d/ai_awareness_and_evolution/,False,False,False,False
1ikjt90,Great Expectations with MS Fabric,0,0,moritzis,2025-02-08 09:44:15,https://www.reddit.com/r/dataengineering/comments/1ikjt90/great_expectations_with_ms_fabric/,False,False,False,False
1il22aa,How to use Optimize Tenser flow on Intel system for Intel?,0,1,dhruv_14,2025-02-09 00:26:47,https://www.reddit.com/r/dataengineering/comments/1il22aa/how_to_use_optimize_tenser_flow_on_intel_system/,False,False,False,False
1ikl8u4,Revolutionary Database?,0,6,Greedy-Big-5625,2025-02-08 11:24:58,https://www.reddit.com/r/dataengineering/comments/1ikl8u4/revolutionary_database/,False,False,False,False
